{
  "$schema": "https://json-schema.org/draft/2020-12/schema",
  "type": "object",
  "required": [
    "schema_version",
    "artifact_type",
    "plan_id",
    "changes"
  ],
  "properties": {
    "schema_version": {
      "const": "1"
    },
    "artifact_type": {
      "const": "plan-file-changes"
    },
    "plan_id": {
      "type": "string",
      "minLength": 1
    },
    "changes": {
      "type": "array",
      "items": {
        "$schema": "https://json-schema.org/draft/2020-12/schema",
        "type": "object",
        "required": [
          "id",
          "path",
          "operation",
          "requirement_ids",
          "purpose",
          "implementation"
        ],
        "properties": {
          "id": {
            "type": "string",
            "minLength": 1
          },
          "path": {
            "type": "string",
            "minLength": 1
          },
          "operation": {
            "type": "string",
            "minLength": 1
          },
          "requirement_ids": {
            "type": "array",
            "items": {
              "type": "string",
              "minLength": 1
            },
            "uniqueItems": true
          },
          "purpose": {
            "type": "string",
            "minLength": 1
          },
          "implementation": {
            "type": "array",
            "items": {
              "type": "string",
              "minLength": 1
            }
          },
          "dependencies": {
            "type": "array",
            "items": {
              "type": "string",
              "minLength": 1
            },
            "uniqueItems": true
          }
        },
        "additionalProperties": true
      }
    }
  },
  "additionalProperties": true
}
